{
  "api_version": "proof.dev/principal-status/v1",
  "authority_sequence": 6,
  "previous_authority_record_digest": "blake3:7226b9cdfb5fb291ea6640f19c3f827dedcf7167e4195a10a155c768a35b7615",
  "workspace_id": "019c0000-0000-7000-8000-000000000001",
  "principal_id": "019c0000-0000-7000-8000-000000000003",
  "principal_type": "agent",
  "enabled": false,
  "recorded_by_principal_id": "019c0000-0000-7000-8000-000000000002",
  "recorded_at": "2026-08-17T20:10:00Z"
}
