{
  "api_version": "proof.dev/principal-status/v1",
  "authority_sequence": 2,
  "previous_authority_record_digest": "blake3:771b057af206adbb2699b97d2c50cc1369e065071d6ab49a0602b40d90319c0a",
  "workspace_id": "019c0000-0000-7000-8000-000000000001",
  "principal_id": "019c0000-0000-7000-8000-000000000003",
  "principal_type": "agent",
  "enabled": true,
  "recorded_by_principal_id": "019c0000-0000-7000-8000-000000000002",
  "recorded_at": "2026-08-17T19:58:00Z"
}
